id,name,trigger,triggerKeywords,action,priority,riskLevel,status,sourceReviewId,createdAt,updatedAt
1,物流延迟优先安抚规则,客户提到快递未到、物流不更新、物流延迟等问题,"[""快递没到"",""物流不更新"",""物流延迟""]",先道歉安抚，再询问订单号，最后说明会协助查询物流状态,90,low,active,2,2026-06-05T14:18:00.729Z,2026-06-05T14:18:00.729Z
2,通用礼貌回应规则,客户提出问题或表达不满,"[""怎么回事"",""为什么"",""不满意""]",先表达理解，再说明会协助处理，必要时进一步询问信息,50,low,active,6,2026-06-05T16:03:56.640Z,2026-06-05T16:03:56.640Z
3,开场白触发规则,客户发起对话或客服首次回复时的第一个消息,"[""首次回复"",""对话开始""]",必须使用标准开场白“您好，我是您的专属客服，很高兴为您服务~”,90,low,active,39,2026-06-06T03:14:57.575Z,2026-06-06T03:14:57.575Z
4,自提门店信息提供规则,客户询问蛋糕或自提商品，并询问具体门店或需要自提指引时,"[""蛋糕"",""自提"",""门店"",""在哪自提"",""自提点""]",优先从订单中查询自提门店信息直接告知客户；若无法确定，则主动说明可为客户查询门店电话，并引导客户提供订单号等必要信息。,90,low,active,201,2026-06-06T14:16:13.034Z,2026-06-06T14:16:13.034Z
5,收到订单号自动回复规则,客户在聊天中发送明显为订单号的字符串（如纯数字、字母数字组合，长度8-20位）,"[""订单号"",""下单编号"",""订单编号"",""order"",""很多数字""]",立即回复确认话术：“好的，收到您的订单号了，请您稍等片刻，这边马上为您查询”。同时将订单号提取到后台查询队列，避免重复回复。,90,low,active,209,2026-06-07T08:27:48.735Z,2026-06-07T08:27:48.735Z
